id,text
common_voice_da_28221064,Ødelægge et sådant kunstværk
common_voice_da_28221065,hvor yndigt de synger!
common_voice_da_28221066,Hvorfor etableres der ikke områder med rygeforbud?
common_voice_da_28221067,Den masede og kvasede mig
common_voice_da_28221068,Velkommen i det grønne!
common_voice_da_28221069,Blot hun vilde det.
common_voice_da_28221070,Han så på hende og hun sang salmen
common_voice_da_28221071,Hente penge! sagde heksen
common_voice_da_28221072,Bilaget indeholder endvidere bestemmelser om tilsynsførende ved teoriprøver
common_voice_da_28221073,Gid jeg var rig!
common_voice_da_28221074,Af skolemesters have lærte man godt danmarks landkort
common_voice_da_28221075,For deltagelse i kurser betaler kursisten det af uddannelsescentret fastsatte beløb
common_voice_da_28221076,"Manden er arresteret for en misgerning, hun fører selv færgebåden, næver har hun"
common_voice_da_28221077,Der er sket et paradigmeskifte tidligere
common_voice_da_28221078,"Hver ordfører har jo lige så mange stemmer, som der er medlemmer i gruppen."
common_voice_da_28221079,"Vi rider til herregården, hvor vi var i fjor"
common_voice_da_28221080,' sagde manden og så nu ret nøje på mig.
common_voice_da_28221081,Så uendelig meget i en eneste bog
common_voice_da_28221082,"Herregud, hvor er jeg! sagde han og svimlede ved at betænke det."
common_voice_da_28221083,Jeg hørte det af hans egen mund
common_voice_da_28221084,"det er jo den første bogtrykker, der har været i Danmark?"
common_voice_da_28221085,"Opad bakken, nedad bakken,det er hele almanakken"
common_voice_da_28221086,"han vidste slet intet derom, kunne ikke engang drømme om hende."
common_voice_da_28221087,Jeg trækker min sabel ud og hugger dit hoved af!
common_voice_da_28271522,"Dér sad hunden med øjnene, så store som tekopper og gloede på ham."
common_voice_da_28271524,"Jeg har rørt ved den, jeg vil nu tage lidt fastere"
common_voice_da_28271529,"Hvem kan være smukkere, end I, men roserne rystede med hovedet og sagde."
common_voice_da_28271535,"Jeg gad nok vide, hvorledes dette løber af!"
common_voice_da_28271536,Hvem der kunne komme derop
common_voice_da_28271547,Men skrubtudseungerne strakte bagbenene af bare stolthed
common_voice_da_28271548,"De så tovet, hvis begyndelse og ende svandt i deres synskreds"
common_voice_da_28271549,Nu skal jeg spørge min troldmand.
common_voice_da_28271550,"Tællelyset brændte, og moder syntes at der var en høvlspån i lyset"
common_voice_da_28271551,Lover du mig det?
common_voice_da_28271558,"Sligt blev nok aldrig set af en landsbyskrædder, sagde hun"
common_voice_da_28271559,Det kan i bilde tosser ind
common_voice_da_28271560,nej det var ækelt!
common_voice_da_28271561,"Jeg løftede hende, jeg holdt hende, jeg stødte hende frem"
common_voice_da_28271562,Da klang jagthorn mellem bjergene.
common_voice_da_28271563,Vores velstand kommer fra handel med andre lande.
common_voice_da_28271564,udpeger en voldgiftsmand
common_voice_da_28271565,Regionsrådet udarbejder en samlet plan for tilrettelæggelsen af regionens virksomhed på sundhedsområdet
common_voice_da_28271566,han har ædt to af mine.
common_voice_da_28271572,Pelsdyr må ikke løftes eller bæres i halen eller ørene.
common_voice_da_28271573,det var ikke den fornøjeligste tid for de fattige.
common_voice_da_28271574,Er der en cykeludlejning her et sted?
common_voice_da_28271575,"Han er kun gemen matros, så må loven have sin gænge"
common_voice_da_28271576,Er det dig jeg ser
common_voice_da_28271577,"Jeg vil se dem, sagde han."
common_voice_da_28271578,Men hans moder holdt på ham
common_voice_da_28271579,Og hun gik ud af stuen
common_voice_da_28271580,Ministeren kan fastsætte nærmere vilkår for dispensation
common_voice_da_28271581,Nu hørte han én komme ridende på landevejen hen imod huset.
common_voice_da_28271582,"sagde den, De trådte så hårdt, madame!"
common_voice_da_28271583,"Men han havde ingen skjorte, og kaldte sig dog det lykkeligste menneske"
common_voice_da_28271584,Den havde ligget tværs over ryggen på en af tyrene.
common_voice_da_28271585,Publikum er træt.
common_voice_da_28271586,Alt det gav den gode frue den fattige dreng
common_voice_da_28271587,Sundheds- og ældreministeren fastsætter beløbets størrelse
common_voice_da_28271588,"Forældremyndighedens indehaver, værge eller de nærmeste pårørende skal efterfølgende orienteres herom."
common_voice_da_28271589,"Spørg dem kun ad, så skal du høre, hvad de siger."
common_voice_da_28271590,"Dér sad hunden med øjne så store, som et møllehjul."
common_voice_da_28271591,Det er noget så herligt og kosteligt
common_voice_da_28271592,Hun levede kun rigtig i de ni komediemåneder
common_voice_da_28271593,Nu går jeg og lurer
common_voice_da_28271594,"Nu gad jeg dog nok vide, hvor vidt de er med tøjet!"
common_voice_da_28271595,men Dem blev endnu mere givet!
common_voice_da_28271596,"Halsen kunne han bekvemt bevæge, men det var også alt."
common_voice_da_28271597,Man burde sætte over alle hurdler — og fly!
common_voice_da_28271598,De slag kunne jeg have haft godt af som lille
common_voice_da_28271604,"Vinduerne sad så højt oppe og glassene var røde, blå og gule"
common_voice_da_28271605,Kender De ikke Historien om Manden? sagde han.
common_voice_da_28271607,det syn undte jeg mor.
common_voice_da_28279678,Kæret er tilgroet med rør og bukkeblade
common_voice_da_28279679,Der var stor festlighed i landsherrens hovedstad.
common_voice_da_28279680,vil De ikke skaffe mig en droske ud til Christianshavn!
common_voice_da_28279681,"Denne kørelærer skal forinden sikre sig, at undervisningsplanen er fulgt"
common_voice_da_28279682,Og den lille voksede og verden voksede for ham.
common_voice_da_28279683,Det snurrer og surrer
common_voice_da_28279684,Ja man må lide noget for stadsen!
common_voice_da_28279685,Det er som hørte man en sang
common_voice_da_28279686,Nå det fornøjer os!
common_voice_da_28279687,Andet sted kan hun ikke komme.
common_voice_da_28279688,Dette er et citat fra selve teksten.
common_voice_da_28279690,"Der var en gammel gård, det var inde i den store, travle by"
common_voice_da_28279691,sagde han og svimlede ved at betænke det.
common_voice_da_28279692,"Jeg får kuldegys i næbbet, når jeg tænker derpå"
common_voice_da_28279694,"Samrådets afgørelse kan indbringes for ankenævnet af ansøgeren, forældremyndighedens indehaver og værgen"
common_voice_da_28279698,Hun skal lege med mig
common_voice_da_28279699,Hun fik også sangen at høre og var med i den
common_voice_da_28279700,Den er kun en ringe blomst fra køkkenhaven
common_voice_da_28279701,her er også utilgiveligt hedt herinde!
common_voice_da_28279702,Ak nu har jeg slet ingen heste mere! sagde lille Claus.
common_voice_da_28523295,"Vi håber, at det luxembourgske formandskab vil udtænke en mere rimelig løsning."
common_voice_da_28523296,I den periode har vi oplevet både højdepunkter og lavpunkter i den europæiske politik.
common_voice_da_28523297,"Det vil således være uhensigtsmæssigt, hvis jeg på nuværende tidspunkt uddyber det nærmere."
common_voice_da_28523298,Selv tilhørerlogen er ved at være tom.
common_voice_da_28523299,"Den aktuelle trussel om en muteret fugleinfluenza viser, hvilken rolle industrien skal spille."
common_voice_da_28523300,"Det har givet håb, hvor der var fortvivlelse."
common_voice_da_28523301,"Det lyder måske hårdt, for min skyld måske endda simpelt, men sådan er det."
common_voice_da_28523302,"Her er det snarere burindustriens interesser, der ligger bag."
common_voice_da_28523303,"Sankthansorme fløj skinnende rundt om, som små svævende lys"
common_voice_da_28523304,"Det er til en vis grad en latent besparelse, man lader os stemme om."
common_voice_da_28523310,Det er en cadeau til formandskabet.
common_voice_da_28523311,"Lærdommen fik han, og den kom under March!"
common_voice_da_28523313,For det femte er den påtænkte retlige brug af de nævnte oplysninger ukontrolleret.
common_voice_da_28523315,Verdenssamfundet har samstemmigt anerkendt ham.
common_voice_da_28523318,"Vær opmærksom på, at midlerne til kultur hovedsageligt er rettet mod de store bycentre."
common_voice_da_28523330,Nede omkring torvet var der liv og lys endnu.
common_voice_da_28523331,"Det var min hensigt, men jeg vendte papiret for hurtigt."
common_voice_da_28523332,Ecuen havde således en vis stabilitet.
common_voice_da_28523333,"Det andet spørgsmål er specielt, og det går på beskyttelsen af den hvide haj."
common_voice_da_28523334,Det trænger sig derfor på at gøre status over forbindelserne med vores alpine nabo.
common_voice_da_28523345,Vi må undersøge denne sag omgående.
common_voice_da_28523346,Krisens økonomiske omkostninger er endnu ikke endeligt opgjort.
common_voice_da_28523347,Under sådanne omstændigheder ville det være dumt ikke at udvide dagsordenen.
common_voice_da_28523348,Det var angiveligt et rovmord begået af unge.
common_voice_da_28523349,Sundhedsspørgsmål vil fortsat være centrale med en større præventiv indsats imod pandemier.
common_voice_da_28523359,Jeg kommer nu tilbage til mine kuverter.
common_voice_da_28523375,I nogle tilfælde er der tale om tocifrede procentvise nedskæringer.
common_voice_da_28523376,Min fader var kongelig strømpevæver
common_voice_da_28523377,"Mulder ville have været enig med mig, hvis han havde været til stede."
common_voice_da_28523388,"Dertil skal først og fremmest udbuddet gøres bedre, mere forskelligartet og mere konkurrencedygtigt."
common_voice_da_28523389,Fra nu af vil hvert led i fødekæden blive en integreret del af produktionsprocessen.
common_voice_da_28523390,"Ingen levende organismer, fra mikrober til oddere, er blevet skånet."
common_voice_da_28523391,Hun gik så sin vej med alle køerne og tyrene.
common_voice_da_28523392,Vi lader forbryderen gå ustraffet og behandler ofret letsindigt.
common_voice_da_28523403,"Deres udtalelser var imidlertid som altid meget afmålte, men dybest set meget overdrevne."
common_voice_da_28523404,"Men alle dem, som spurgte, hvad huderne kostede, svarede han: ""en skæppe penge."""
common_voice_da_28523405,Hvilket lingvistisk system skal der anvendes?
common_voice_da_28523406,"Hvis dette ikke sker, bliver demokratiet en deformeret størrelse."
common_voice_da_28523407,"Kommissionens forslag om at fastsætte nogle maksimumstakster er det spørgsmål, vi nu drøfter."
common_voice_da_28523418,"Det bliver værre for udviklingslandene, fordi udbredelsen af ørknerne rammer dem i særlig grad."
common_voice_da_28523419,Dernæst skal vi tilføje målrettede politikker.
common_voice_da_28523420,"Men de småpenge, de får, kan måske lette deres trængsler."
common_voice_da_28523421,Terrorismen kan ikke altid gribes an på samme måde.
common_voice_da_28523422,"Det er ikke det blæk værd, som det er skrevet med."
common_voice_da_28523428,Lavspændingsdirektivet og maskindirektivet dækker allerede mange spørgsmål i denne henseende.
common_voice_da_28523429,Trods visse oratoriske forholdsregler er denne tekst faktisk ikke afbalanceret og retfærdig.
common_voice_da_28523430,Ville en tese om større forbrug løse problemerne?
common_voice_da_28523431,"Selv det vand, der indvindes fra slammet, renses for rester af cyanid."
common_voice_da_28523432,Mit indlæg handler om den nordiske pasunion.
common_voice_da_28523453,Han har nu tænkt sig at lede en politisk sprængfarlig regering.
common_voice_da_28523454,Og siden da er den europæiske økonomi uafbrudt blevet bedre.
common_voice_da_28523455,"Særlig de, der taler urbefolkningens og de fattige samfunds sag, løber en stor risiko."
common_voice_da_28523456,En atomulykke er ikke det samme som en togulykke.
common_voice_da_28523457,I rigtigt mange lande er rørsystemet til drikkevand på nuværende tidspunkt af kobber.
common_voice_da_28523462,Det allervigtigste mål for den er at nå ned på nul ofre.
common_voice_da_28523463,"Der er nok, som allerede er sivet bort."
common_voice_da_28523464,Tobak er en gift og en rusgift.
common_voice_da_28523466,Pleje af børn og ældre slægtninge er under alle omstændigheder fortsat en opgave.
common_voice_da_28523467,"I dag har vi styrket kvindernes rettigheder, men også mændenes med fædreorloven."
common_voice_da_28523468,"Det er vigtigt, mener jeg, at sætte fingeren på dette ømme punkt."
common_voice_da_28523469,Argumentet er kolonien af murmeldyr.
common_voice_da_28523470,Vore bestræbelser i den henseende ænses knap nok i de internationale medier.
common_voice_da_28523471,Det kan være direkte misvisende at angive et oprindelsesland.
common_voice_da_28523472,Talibanernes magtovertagelse stiller udviklingen århundreder tilbage til den mørkeste middelalder.
common_voice_da_28523473,Princippet med dobbelt flertal er ikke et sagnvæsen.
common_voice_da_28523474,Dels på grund af krig og ufred og dels på grund af naturkatastrofer.
common_voice_da_28523476,Som om vi alle gemmer kvitteringer for alle vores indkøb!
common_voice_da_28523477,Vi har fanget millioner i afhængighedens elendighed.
common_voice_da_28523479,"Det er ret pinligt, i betragtning af at alle andre har udtalt sig."
common_voice_da_28523483,"Det er åbenlyst, at vores skove er mangfoldighedens vugge."
common_voice_da_28523484,"Det forsøger at købslå sig frem, men er dømt til at mislykkes."
common_voice_da_28523485,Det er min bedstemoder!
common_voice_da_28523486,"Spørgsmålet om, hvordan de bliver behandlet, har vakt international bekymring."
common_voice_da_28523487,Hverken flertalsafgørelser eller kompensationer i huj og hast gør en uretfærdig behandling retfærdig.
common_voice_da_28523493,I mit tidligere indlæg kunne jeg ikke afse tid til dette.
common_voice_da_28523494,"Vi kan se, at der er en mangel på sammenhæng flere steder i teksten."
common_voice_da_28523495,En anden ting er definitionen af information og høring.
common_voice_da_28523496,I virkeligheden var den en gammel krikke.
common_voice_da_28523498,"Efter at to forslag til havnedirektiv er kuldsejlet, måtte der nytænkes."
common_voice_da_28523499,"Loyalitet bygger ikke kun på statsborgerskab, men også på fælles holdninger."
common_voice_da_28523500,"Det er en af de pointer, jeg i særlig grad gerne vil understrege."
common_voice_da_28523501,"Men der ville blive et ramaskrig, hvis vi ikke gjorde os umage."
common_voice_da_28523502,Det afstedkommer naturligvis mange frustrationer.
common_voice_da_28523518,"Uden at i bliver som børn, kommer i ikke i guds rige"
common_voice_da_28523519,"Hvordan skal man kontrollere, om denne logbog er korrekt?"
common_voice_da_28523520,Men det estiske samfund er blevet opdelt i vindere og tabere.
common_voice_da_28523521,Vi skal fra nu af indsætte de mulige joint action teams.
common_voice_da_28523522,Ankaras politikker kan fungere som model for de arabiske lande i regionen.
common_voice_da_28523533,Det er jeg revnende ligeglad med.
common_voice_da_28523534,"Halvdelen af de unge tjenestemænd, som rekrutteres fra de nye medlemsstater, er kvinder."
common_voice_da_28523535,Her er dejligt i efteråret
common_voice_da_28587466,"se, nu bliver vejret godt udenfor."
common_voice_da_28587467,Hvordan kommer vi nu ind
common_voice_da_28587468,"Desuden mener jeg, at vi bør støtte genopbygningen af de grundlæggende serviceydelser."
common_voice_da_28587469,Desværre består denne tradition næsten udelukkende af smertefulde begivenheder og uretfærdigheder.
common_voice_da_28587470,"Hvem overlader nutidens videnskabsmænd og forskere projekter, som nødvendigvis er djævelske?"
common_voice_da_28587560,Gevinsten fra en større lastvogn vil blive ædt op af den stigende transportmængde.
common_voice_da_28587561,"Kusk, tjenere og forridere, for der var også forridere, sad klædt i guldkroner"
common_voice_da_28587562,Hvilken betydning har internettet for børn i dag?
common_voice_da_28587563,Vores samfund blev skabt under indflydelse af de jakobinske stater.
common_voice_da_28587564,"Der er børn, der tilbringer flere timer om dagen med at surfe på internettet."
common_voice_da_28587575,Uformel betyder på fransk misformet og ugraciøs.
common_voice_da_28587577,"Der er behov for handling, ikke for papir og poesi."
common_voice_da_28587578,Større forståelse er blevet nævnt.
common_voice_da_28587579,Den årlige tildeling må ikke overstige denne øvre grænse.
common_voice_da_28662021,Jeg syntes at hun smilede så lumskelig
common_voice_da_28662026,Det har jeg luret mig til og nu har jeg luret igen
common_voice_da_28662030,Det sidste kan godt gå hen at blive meget vanskeligt.
common_voice_da_28662031,Egypten er et stort og vigtigt land med en rig historie.
common_voice_da_28687294,"sagde hun, oh Gud, hvor jeg dog gerne ville se det!"
common_voice_da_28687295,Babel vil utvivlsomt bygge sit tårn.
common_voice_da_28687296,Men disse gode år er ovre.
common_voice_da_28687297,Disse mænds og kvinders mod er beundringsværdigt.
common_voice_da_28687298,"Det handler om kalorieoutput, ikke blot om kalorieinput."
common_voice_da_28687299,Udvekslingen af bedste praksis er meget vigtig.
common_voice_da_28687300,Det skylder vi det ukrainske samfund og dets gryende demokrati.
common_voice_da_28687301,Den kan ikke skjule den totale mangel på grundlæggende indrømmelser fra amerikansk side.
common_voice_da_28687302,"Lomas, at jeg som formand havde udtrykt mig helt klart."
common_voice_da_28687303,"Jeg husker stadig, at mange dengang drillede hende med, at hun så spøgelser."
common_voice_da_28687309,"Og vi bør indrette vores lovgivninger, således at der sættes en stopper for sexturisme."
common_voice_da_28687310,"Så stiger nervøsiteten og væddemålene om, hvem der først når målstregen."
common_voice_da_28687311,"Europa har nogle fordele, der giver en vis pondus i den globale debat."
common_voice_da_28687312,Vil de så tilsige den rigtige
common_voice_da_28687313,"jo, De skulle prøve, at sidde i retten med de trivielle sager!"
common_voice_da_28687314,"Det var jo nogle dejlige klæder, tænkte kejseren."
common_voice_da_28687316,Overordnet set er buspassagerer som helhed blevet dårligere stillet.
common_voice_da_28687322,"Jeg gror, at der stadig er gennemført særdeles lidt på disse tre områder."
common_voice_da_28687326,"På langt sigt har vi brug for mere kongruens, hvis vi vil undgå konkurrenceforvridninger."
common_voice_da_28687328,Verden kalder hende Den Mediceiske Venus.
common_voice_da_28687334,"Bygninger, der ligger øde hen, vil uvægerligt blive syge, hvis de ikke kontrolleres regelmæssigt."
common_voice_da_28687335,"De ubeføjede klager er faktisk meget vigtige, og vi vil forsøge at reducere dem."
common_voice_da_28687336,"Vi ville ikke have lucerne, som indgår i kvægfoder."
common_voice_da_28687337,Indbyggere kan stadig ikke vende tilbage og sygner hen i flygtningelejre.
common_voice_da_28687338,Med henblik på en ønsket afpolitisering af samfundet er det derimod et probat middel.
common_voice_da_28687346,Hæren og militæret kastede sig ud i den mest sadistiske form for brutalitet.
common_voice_da_28687349,Det er lykkedes ham at sy et holdbart kompromis sammen imod alle odds.
common_voice_da_28687352,"Hvad angår fugleinfluenza, vil vi få flere udbrud."
common_voice_da_28687354,Allergene parfumestoffer forbydes også i overvejende grad.
common_voice_da_28687356,Jeg forstår logikken i at foreslå et forbud mod brug af palmeolie.
common_voice_da_28687359,"Men ak, de mange ekstremister opbygger forhindringer."
common_voice_da_28687360,"De var ikke velhavende, men flygtede fra fattigdom."
common_voice_da_28687362,"Det handler om dagblade, ugeaviser og andre pakkeforsendelser."
common_voice_da_28687363,Alle vandlevende organismer blev udryddet i en afstand af op til flere hundrede km.
common_voice_da_28687365,"Den lille røde bog fik tilsyneladende kolossal betydning, enorm betydning."
common_voice_da_28687369,"Jeg er imidlertid ikke enig i, at uldvarer skal gøres til genstand for overvågning."
common_voice_da_28687370,Markedsmisbrug og insiderhandel har givet mange småaktionærer tab.
common_voice_da_28687371,Men tilbage til manuskriptet.
common_voice_da_28687372,"Jeg mener, at der er nogle huller i deres forslag."
common_voice_da_28687373,Kvinder bliver degraderet til råstofleverandører af ægceller.
common_voice_da_28793862,"min egen skæbne, kunstens, land og riges"
common_voice_da_28793863,Også blandt rektorer og i skolevæsenerne kan der herske stor usikkerhed.
common_voice_da_28793864,De forsøger også at opildne forbrugerne til at tage del i deres kampagne.
common_voice_da_28793865,Jeg kommer i potte
common_voice_da_28793866,Dette glas skal bruges til at drikke af.
common_voice_da_28793872,De nytilkomne har optaget helt nye eller ledige job.
common_voice_da_28793873,Selv dværgene burde kunne rejse sig i deres fulde højde.
common_voice_da_28793874,Derfor passes der på det som en øjesten.
common_voice_da_28793876,"Vi vil være forsigtige med nye love, for erhvervslivet klager over for meget regulering."
common_voice_da_28793877,De to lejre består af henholdsvis optimister og pessimister.
common_voice_da_28793882,"den stiger op igennem den klare luft, op til alle de skinnende stjerner!"
common_voice_da_28793883,Hvordan genkender borgerne sig heri?
common_voice_da_28793884,Egentlig er man for en økonomisk boykot.
common_voice_da_28793885,Vanskeligt kontrollerbare sygdomme såsom ebola har spredt sig til mennesker.
common_voice_da_28793886,"Når løven, der brøler i den økonomiske jungle, bliver våd, opdager den solidaritetens fordele."
common_voice_da_28793892,Det er ikke let for dem at involvere sig.
common_voice_da_28793893,Denne erfaring bør være den væsentligste præmis bag en helt ny reform af traktatsystemet.
common_voice_da_28793894,For det andet skal vi samle rumindustrien.
common_voice_da_28793895,Kan professoren da forstå pantomime? spurgte Ida.
common_voice_da_28793896,De nye ministre aflægger ed i dag.
common_voice_da_28793902,"Ligeledes ønsker jeg, at det spanske formandskab får succes og handler med stor kløgt."
common_voice_da_28793903,"Fordelen er, at vi reducerer udgifterne til veksling af penge samt andre transaktionsudgifter."
common_voice_da_28793904,"Men de, der klamrer sig til fortidens job, begrænser fremtidens job."
common_voice_da_28793905,"Flere egne, landsbyer, bydele, bykvarterer og veje er blevet ødelagt af jordskælvet."
common_voice_da_29307781,Betaling sker til kommunen efter kommunalbestyrelsens nærmere bestemmelse herom
common_voice_da_29307782,"Vi advarer Dem, lille sangfugl!"
common_voice_da_29307783,Det er efter vores mening helt skørt.
common_voice_da_29307784,"Vi evaluerer, hvor vi står, og hvilket potentiale vi har."
common_voice_da_29307785,Hvilke forholdsregler må vi træffe?
common_voice_da_29307796,der var to mennesker derinde.
common_voice_da_29307797,"De oplever, hvordan deres hjem rives ned."
common_voice_da_29307798,Sumpbævere skal holdes i grupper.
common_voice_da_29307799,"Fru formand, det er ved at blive ensformigt at tale om de tyrkiske grovheder."
common_voice_da_29307800,Med andre ord drejede det sig om en lille uvarslet demonstration.
common_voice_da_29307807,Det tænkte hun nu på
common_voice_da_29307808,"Se nu til, at du læser ordentligt!"
common_voice_da_29307809,"Oh, det ville blive et skrækkeligt vejr!"
common_voice_da_29307811,Virkningerne er katastrofale.
common_voice_da_29307812,"Agurk og asparges sad som æresgæst,kartoflerne stod og sang kor"
common_voice_da_29307825,"Hun bandt båndet fast til, og stødte så til den."
common_voice_da_29307827,Men hun havde nu skaffet ham derop
common_voice_da_29307828,Hvalp har jeg været.
common_voice_da_29307831,"Når vi har levet længe nok, får døden ordre"
common_voice_da_29307835,"Jeg vil som dansker gerne sige, at det er jeg fuldstændig enig i."
common_voice_da_29307852,"Nej, det kan jeg ikke!"
common_voice_da_29307853,"Er det designet, materialerne, kvaliteten af konstruktionen eller bygningstilsynet?"
common_voice_da_29307854,For denne ene gang din lyst jeg stiller
common_voice_da_29307855,"Nu skulle jeg rigtignok fortælle et eventyr, men jeg kan ingen flere"
common_voice_da_29307856,Alle mennesker ville de gøre glade som de selv var det
common_voice_da_29307872,"Min egen fremtid? Ja, De ved, ens eget"
common_voice_da_29307873,"Fejlen fik tragiske konsekvenser, og det er korrekt af os at fordømme den."
common_voice_da_29307874,"Det skal du få, sagde bonden."
common_voice_da_29307876,Så tænker ingen på snemanden!
common_voice_da_29307877,"Det glæder mig, at vi kan sige velkommen til en ny kvinde på podiet."
common_voice_da_29307893,"Jeg håber, at vi er på rette spor her."
common_voice_da_29307894,"Det styres af hemmelige udvalg, brovtende ansigtsløse bureaukrater og foregivet ansvarlighed."
common_voice_da_29307895,Også det må vi kritisk tage på vores egen kappe.
common_voice_da_29307897,Hvad vil du med de ris? spurgte Johannes nu sin rejsekammerat.
common_voice_da_29307898,De tav igen.
common_voice_da_29307915,Hvem har gjort det?
common_voice_da_29307916,"Vi bør sørge for, at der ikke bliver leveret flere alibier."
common_voice_da_29307917,Mange virksomheder bliver opkøbt eller modtager finansiel bistand gennem disse fonde.
common_voice_da_29307918,"Det kan undtagelsesvist accepteres, at køreeleven er en eller flere teorilektioner foran"
common_voice_da_29307919,"Og for det tredje skal vi forfølge en holistisk politik, ikke en fragmenteret."
common_voice_da_29307955,I de senere år har den europæiske biovidenskab og bioteknologi allerede haft succes.
common_voice_da_29307956,Det er desværre ikke et nyt råb.
common_voice_da_29307957,Sukker kan anvendes til andet end slik.
common_voice_da_29307958,"Jeg tror, at vi her i denne sal er på rette vej."
common_voice_da_29307959,Jeg overlevede dem alle
